{
  "$schema": "https://json-schema.org/draft/2020-12/schema",
  "$id": "https://s15p21a306.local/contracts/event-schema.json",
  "title": "S15P21A306 Raw Event",
  "description": "Collector가 서버 메타데이터를 추가해 Kafka에 발행하는 Raw Event 1건의 계약",
  "type": "object",
  "additionalProperties": false,
  "required": [
    "schema_version",
    "event_id",
    "event_name",
    "intent",
    "occurred_at",
    "persona_id",
    "session_id",
    "page_view_id",
    "sequence_no",
    "page_type",
    "product_id",
    "actor_type",
    "environment",
    "received_at",
    "source",
    "request_id",
    "event_index",
    "account_id",
    "properties"
  ],
  "properties": {
    "schema_version": {
      "enum": [
        "0.2.0-draft"
      ]
    },
    "event_id": {
      "type": "string",
      "minLength": 1
    },
    "event_name": {
      "type": "string",
      "enum": [
        "session_start",
        "page_view",
        "product_view",
        "product_impression",
        "navigation_click",
        "product_click",
        "section_view",
        "section_dwell",
        "accordion_toggle",
        "recommendation_impression",
        "recommendation_click",
        "wishlist_toggle",
        "add_to_cart",
        "view_cart",
        "exit_summary",
        "scroll_depth",
        "impression_dwell",
        "recommendation_snapshot",
        "media_view",
        "quick_look",
        "quick_look_close",
        "remove_from_cart",
        "variant_select",
        "quantity_change",
        "review_filter_apply",
        "review_expand",
        "ingredient_view_mode_change",
        "sort_change",
        "filter_change",
        "scroll_pause",
        "scroll_backtrack",
        "text_selection",
        "text_copy",
        "hover_dwell",
        "rage_click",
        "dead_click",
        "begin_checkout",
        "purchase",
        "purchase_reason_select",
        "banner_impression",
        "banner_click",
        "login",
        "payment_failed"
      ]
    },
    "intent": {
      "type": "string",
      "enum": [
        "session",
        "exposure",
        "interest",
        "comparison",
        "validation",
        "hesitation",
        "conversion",
        "friction"
      ]
    },
    "occurred_at": {
      "type": "string",
      "format": "date-time"
    },
    "persona_id": {
      "type": [
        "string",
        "null"
      ]
    },
    "account_id": {
      "type": [
        "string",
        "null"
      ]
    },
    "session_id": {
      "type": "string",
      "minLength": 1
    },
    "page_view_id": {
      "type": "string",
      "minLength": 1
    },
    "sequence_no": {
      "type": "integer",
      "minimum": 1
    },
    "page_type": {
      "type": "string",
      "enum": [
        "product_detail",
        "product_list",
        "cart"
      ]
    },
    "product_id": {
      "anyOf": [
        {
          "type": "string",
          "minLength": 1
        },
        {
          "type": "null"
        }
      ]
    },
    "actor_type": {
      "type": "string",
      "enum": [
        "user",
        "synthetic"
      ]
    },
    "environment": {
      "type": "string",
      "minLength": 1
    },
    "received_at": {
      "type": "string",
      "format": "date-time"
    },
    "source": {
      "type": "string",
      "enum": [
        "web",
        "simulator"
      ]
    },
    "request_id": {
      "type": "string",
      "minLength": 1
    },
    "event_index": {
      "type": "integer",
      "minimum": 0
    },
    "properties": {
      "type": "object"
    }
  },
  "allOf": [
    {
      "if": {
        "properties": {
          "event_name": {
            "enum": [
              "page_view",
              "section_view",
              "section_dwell",
              "scroll_depth",
              "scroll_pause"
            ]
          },
          "page_type": {
            "const": "product_detail"
          }
        },
        "required": [
          "event_name",
          "page_type"
        ]
      },
      "then": {
        "properties": {
          "product_id": {
            "type": "string",
            "minLength": 1
          }
        }
      }
    },
    {
      "if": {
        "properties": {
          "event_name": {
            "enum": [
              "product_view",
              "product_impression",
              "product_click",
              "accordion_toggle",
              "recommendation_impression",
              "recommendation_click",
              "wishlist_toggle",
              "add_to_cart",
              "impression_dwell",
              "media_view",
              "quick_look",
              "quick_look_close",
              "remove_from_cart",
              "variant_select",
              "quantity_change",
              "review_filter_apply",
              "review_expand",
              "ingredient_view_mode_change",
              "scroll_backtrack",
              "text_selection",
              "text_copy",
              "hover_dwell",
              "banner_impression",
              "banner_click"
            ]
          }
        },
        "required": [
          "event_name"
        ]
      },
      "then": {
        "properties": {
          "product_id": {
            "type": "string",
            "minLength": 1
          }
        }
      }
    },
    {
      "if": {
        "properties": {
          "actor_type": {
            "const": "synthetic"
          }
        },
        "required": [
          "actor_type"
        ]
      },
      "then": {
        "properties": {
          "source": {
            "const": "simulator"
          },
          "properties": {
            "required": [
              "scenario_id",
              "simulation_run_id",
              "generator_type"
            ],
            "properties": {
              "scenario_id": {
                "type": "string",
                "minLength": 1
              },
              "simulation_run_id": {
                "type": "string",
                "minLength": 1
              },
              "generator_type": {
                "type": "string",
                "enum": [
                  "python_batch",
                  "agent_llm"
                ]
              },
              "seeded": {
                "type": "boolean"
              }
            }
          }
        }
      }
    },
    {
      "if": {
        "properties": {
          "actor_type": {
            "const": "user"
          }
        },
        "required": [
          "actor_type"
        ]
      },
      "then": {
        "properties": {
          "source": {
            "const": "web"
          },
          "properties": {
            "not": {
              "required": [
                "seeded"
              ]
            }
          }
        }
      }
    },
    {
      "if": {
        "properties": {
          "event_name": {
            "enum": [
              "session_start",
              "page_view",
              "navigation_click",
              "exit_summary",
              "banner_impression",
              "login"
            ]
          }
        },
        "required": [
          "event_name"
        ]
      },
      "then": {
        "properties": {
          "intent": {
            "const": "session"
          }
        }
      }
    },
    {
      "if": {
        "properties": {
          "event_name": {
            "enum": [
              "product_impression",
              "recommendation_impression",
              "scroll_depth",
              "impression_dwell",
              "recommendation_snapshot"
            ]
          }
        },
        "required": [
          "event_name"
        ]
      },
      "then": {
        "properties": {
          "intent": {
            "const": "exposure"
          }
        }
      }
    },
    {
      "if": {
        "properties": {
          "event_name": {
            "enum": [
              "product_view",
              "section_view",
              "section_dwell",
              "scroll_pause",
              "media_view",
              "quick_look",
              "quick_look_close",
              "banner_click"
            ]
          }
        },
        "required": [
          "event_name"
        ]
      },
      "then": {
        "properties": {
          "intent": {
            "const": "interest"
          }
        }
      }
    },
    {
      "if": {
        "properties": {
          "event_name": {
            "enum": ["banner_impression", "banner_click"]
          }
        },
        "required": ["event_name"]
      },
      "then": {
        "properties": {
          "properties": {
            "type": "object",
            "required": [
              "banner_type",
              "banner_value",
              "banner_slot",
              "trait_source"
            ],
            "properties": {
              "banner_type": {
                "enum": [
                  "concern",
                  "ingredient",
                  "clean",
                  "price_bin",
                  "category",
                  "segment",
                  "new_brand"
                ]
              },
              "banner_value": {
                "type": ["string", "null"]
              },
              "banner_slot": {
                "type": "integer",
                "minimum": 1
              },
              "trait_source": {
                "enum": ["session", "profile", "coldstart", "explore"]
              }
            },
            "allOf": [
              {
                "if": {
                  "properties": {"banner_type": {"const": "new_brand"}},
                  "required": ["banner_type"]
                },
                "then": {
                  "properties": {"banner_value": {"type": "null"}}
                },
                "else": {
                  "properties": {
                    "banner_value": {"type": "string", "minLength": 1}
                  }
                }
              }
            ],
            "not": {"required": ["slot"]}
          }
        }
      }
    },
    {
      "if": {
        "properties": {
          "event_name": {"const": "purchase"}
        },
        "required": ["event_name"]
      },
      "then": {
        "properties": {
          "properties": {
            "type": "object",
            "required": [
              "order_id",
              "items",
              "payment_method",
              "paid_value",
              "order_channel"
            ],
            "properties": {
              "order_id": {
                "type": "string",
                "minLength": 1
              },
              "items": {
                "type": "array"
              },
              "payment_method": {
                "enum": ["kakaopay", "card", "test"]
              },
              "paid_value": {
                "type": "number",
                "minimum": 0
              },
              "order_channel": {
                "enum": ["backend", "local"]
              },
              "pg_provider": {
                "type": "string",
                "minLength": 1
              },
              "payment_id": {
                "type": "string",
                "minLength": 1
              },
              "paid_at": {
                "type": "string",
                "format": "date-time"
              }
            }
          }
        }
      }
    },
    {
      "if": {
        "properties": {
          "event_name": {"const": "payment_failed"}
        },
        "required": ["event_name"]
      },
      "then": {
        "properties": {
          "properties": {
            "type": "object",
            "required": ["order_id"],
            "properties": {
              "order_id": {
                "type": "string",
                "minLength": 1
              },
              "reason_code": {
                "type": "string",
                "minLength": 1
              },
              "payment_method": {
                "enum": ["kakaopay", "card", "test"]
              }
            }
          }
        }
      }
    },
    {
      "if": {
        "properties": {
          "event_name": {
            "enum": [
              "scroll_backtrack",
              "variant_select",
              "product_click",
              "recommendation_click",
              "filter_change",
              "sort_change"
            ]
          }
        },
        "required": [
          "event_name"
        ]
      },
      "then": {
        "properties": {
          "intent": {
            "const": "comparison"
          }
        }
      }
    },
    {
      "if": {
        "properties": {
          "event_name": {
            "enum": [
              "accordion_toggle",
              "ingredient_view_mode_change",
              "review_expand",
              "review_filter_apply",
              "text_selection",
              "text_copy",
              "purchase_reason_select"
            ]
          }
        },
        "required": [
          "event_name"
        ]
      },
      "then": {
        "properties": {
          "intent": {
            "const": "validation"
          }
        }
      }
    },
    {
      "if": {
        "properties": {
          "event_name": {
            "enum": [
              "hover_dwell",
              "remove_from_cart"
            ]
          }
        },
        "required": [
          "event_name"
        ]
      },
      "then": {
        "properties": {
          "intent": {
            "const": "hesitation"
          }
        }
      }
    },
    {
      "if": {
        "properties": {
          "event_name": {
            "enum": [
              "wishlist_toggle",
              "quantity_change",
              "add_to_cart",
              "view_cart",
              "begin_checkout",
              "purchase",
              "payment_failed"
            ]
          }
        },
        "required": [
          "event_name"
        ]
      },
      "then": {
        "properties": {
          "intent": {
            "const": "conversion"
          }
        }
      }
    },
    {
      "if": {
        "properties": {
          "event_name": {
            "enum": [
              "rage_click",
              "dead_click"
            ]
          }
        },
        "required": [
          "event_name"
        ]
      },
      "then": {
        "properties": {
          "intent": {
            "const": "friction"
          }
        }
      }
    }
  ]
}
