[
  {
    "schema_version": "0.2.0-draft",
    "event_id": "b1f0a5c8-2d34-4a91-8e77-0c5b2f1a9d10",
    "event_name": "begin_checkout",
    "intent": "conversion",
    "occurred_at": "2026-08-31T05:10:00.000Z",
    "persona_id": null,
    "account_id": null,
    "session_id": "session-user-0001",
    "page_view_id": "page-view-user-0001",
    "sequence_no": 12,
    "page_type": "cart",
    "product_id": null,
    "actor_type": "user",
    "environment": "dev",
    "received_at": "2026-08-31T05:10:00.120Z",
    "source": "web",
    "request_id": "request-user-0001",
    "event_index": 0,
    "properties": {
      "items": [
        {
          "product_id": "P420652",
          "quantity": 1,
          "unit_price": 32200
        },
        {
          "product_id": "P54509",
          "quantity": 2,
          "unit_price": 63700,
          "sku_id": "1974565"
        }
      ],
      "cart_value": 159600,
      "currency": "KRW"
    }
  },
  {
    "schema_version": "0.2.0-draft",
    "event_id": "e4a3d8fb-5a67-4d24-b1aa-3f8e5c4d2a43",
    "event_name": "payment_failed",
    "intent": "conversion",
    "occurred_at": "2026-08-31T05:09:40.000Z",
    "persona_id": null,
    "account_id": null,
    "session_id": "session-user-0001",
    "page_view_id": "page-view-user-0001",
    "sequence_no": 12,
    "page_type": "cart",
    "product_id": null,
    "actor_type": "user",
    "environment": "dev",
    "received_at": "2026-08-31T05:09:40.120Z",
    "source": "web",
    "request_id": "request-user-0001",
    "event_index": 0,
    "properties": {
      "order_id": "ORD-20260903-0001",
      "reason_code": "user_cancel",
      "payment_method": "kakaopay"
    }
  },
  {
    "schema_version": "0.2.0-draft",
    "event_id": "c2e1b6d9-3e45-4b02-9f88-1d6c3a2b0e21",
    "event_name": "purchase",
    "intent": "conversion",
    "occurred_at": "2026-08-31T05:10:00.000Z",
    "persona_id": null,
    "account_id": null,
    "session_id": "session-user-0001",
    "page_view_id": "page-view-user-0001",
    "sequence_no": 12,
    "page_type": "cart",
    "product_id": null,
    "actor_type": "user",
    "environment": "dev",
    "received_at": "2026-08-31T05:10:00.120Z",
    "source": "web",
    "request_id": "request-user-0001",
    "event_index": 0,
    "properties": {
      "order_id": "ORD-20260903-0001",
      "items": [
        {
          "product_id": "P420652",
          "quantity": 1,
          "unit_price": 32200
        },
        {
          "product_id": "P54509",
          "quantity": 2,
          "unit_price": 63700,
          "sku_id": "1974565"
        }
      ],
      "order_value": 159600,
      "currency": "KRW",
      "payment_method": "kakaopay",
      "paid_value": 143600,
      "order_channel": "backend",
      "pg_provider": "portone",
      "payment_id": "hwabun-ORD-20260903-0001",
      "paid_at": "2026-08-31T05:10:00.000Z"
    }
  },
  {
    "schema_version": "0.2.0-draft",
    "event_id": "d3f2c7ea-4f56-4c13-a099-2e7d4b3c1f32",
    "event_name": "purchase_reason_select",
    "intent": "validation",
    "occurred_at": "2026-08-31T05:10:00.000Z",
    "persona_id": null,
    "account_id": null,
    "session_id": "session-user-0001",
    "page_view_id": "page-view-user-0001",
    "sequence_no": 12,
    "page_type": "cart",
    "product_id": null,
    "actor_type": "user",
    "environment": "dev",
    "received_at": "2026-08-31T05:10:00.120Z",
    "source": "web",
    "request_id": "request-user-0001",
    "event_index": 0,
    "properties": {
      "order_id": "ORD-20260903-0001",
      "reasons": [
        "ingredient",
        "review_same_skin"
      ],
      "primary_reason": "ingredient",
      "skipped": false
    }
  }
]
