{
  "schema_version": "0.2.0-draft",
  "event_id": "evt-user-0001",
  "event_name": "add_to_cart",
  "intent": "conversion",
  "occurred_at": "2026-08-31T05:10:00.000Z",
  "persona_id": null,
  "account_id": null,
  "session_id": "session-user-0001",
  "page_view_id": "page-view-user-0001",
  "sequence_no": 12,
  "page_type": "product_detail",
  "product_id": "P342",
  "actor_type": "user",
  "environment": "dev",
  "received_at": "2026-08-31T05:10:00.120Z",
  "source": "web",
  "request_id": "request-user-0001",
  "event_index": 0,
  "properties": {
    "sku_id": "SKU342-01",
    "quantity": 1,
    "price_usd": 32
  }
}
